{"framework_version":"1.0.0","user_request":"I am considering entering the German market with my startup.","user_role":"founder","organization_type":"startup","stage":"early-growth","problem_type":"international-expansion","jurisdiction":"Germany","risk_level":"medium","context_profile":"advisory","target_representation":"auto"}
